{
  "schemaVersion": 1,
  "sessionId": "study-a-replace-session-id",
  "sessionType": "dyad-shared-selection",
  "participantCodes": ["participant-code-a", "participant-code-b"],
  "evidenceOrigin": "physical",
  "supervised": true,
  "consentVersion": "study-a-consent-v1",
  "startedAt": "2026-08-01T09:00:00.000Z",
  "endedAt": "2026-08-01T09:30:00.000Z",
  "buildTarget": "native-ios",
  "buildCompletedAt": "2026-08-01T08:00:00.000Z",
  "buildReceiptSha256": "0000000000000000000000000000000000000000000000000000000000000000",
  "routeContractSha256": "0000000000000000000000000000000000000000000000000000000000000000",
  "providerConfigSha256": "0000000000000000000000000000000000000000000000000000000000000000",
  "navigationPolicySha256": "0000000000000000000000000000000000000000000000000000000000000000",
  "sessionSchemaSha256": "981f9413e65c8eebcee35566f02368e099a127a4f5135dc734de6bcf95043618",
  "physicalMockupVersion": "somewhere-physical-v1",
  "physicalMethod": "embodied-wizard-of-oz",
  "claimsEmbodiedPointing": true,
  "measures": {
    "comprehension": "pass",
    "selectionTimeSeconds": 0,
    "comparisonReopeningCount": 0,
    "movementStarted": false,
    "routeSensorFailureCount": 0,
    "stopTrust": "uncertain",
    "revealTrust": "uncertain",
    "falseArrivalCount": 0,
    "missedArrivalCount": 0,
    "displayReadability": "not-observed",
    "oneHandUse": "not-observed",
    "accidentalStopCount": 0,
    "carryComfort": "not-observed",
    "stateDistinction": "not-observed"
  },
  "stop": { "triggered": false, "reason": null },
  "safety": { "openCriticalIssueCount": 0, "issueCodes": [] },
  "privacy": {
    "rawCoordinatesCollected": false,
    "directIdentifiersCollected": false,
    "venueIdentityFreeTextCollected": false,
    "traceStoredPrivately": true
  },
  "supervisorKeyId": "replace-supervisor-key",
  "supervisorAttestationSha256": "0000000000000000000000000000000000000000000000000000000000000000",
  "supervisorSignatureBase64": "REPLACE_WITH_ED25519_SIGNATURE"
}
